{
  "format": "intehrgrator-suggestions",
  "version": "2",
  "target": {
    "format": "openehr-template",
    "targetId": "simple-diagnose-and-vitals"
  },
  "suggestions": [
    {
      "slotId": "simple-diagnose-and-vitals//context/EVENT_CONTEXT/start_time/value",
      "block": {
        "type": "source_query",
        "fields": { "EXPRESSION": "$.timestamp" }
      },
      "note": "Source timestamp over Defaults Map time"
    },
    {
      "slotId": "simple-diagnose-and-vitals//content[openEHR-EHR-SECTION.adhoc.v1]/items[openEHR-EHR-OBSERVATION.blood_pressure.v2]/data/at0001/events/at0006/data/at0003/items/at0004/value/value/value",
      "block": {
        "type": "source_query_number",
        "fields": { "EXPRESSION": "$.systolic" }
      },
      "note": "unitsFixed mm[Hg] — magnitude only"
    },
    {
      "slotId": "simple-diagnose-and-vitals//content[openEHR-EHR-SECTION.adhoc.v1]/items[openEHR-EHR-OBSERVATION.blood_pressure.v2]/data/at0001/events/at0006/data/at0003/items/at0005/value/value/value",
      "block": {
        "type": "source_query_number",
        "fields": { "EXPRESSION": "$.diastolic" }
      },
      "note": "unitsFixed mm[Hg] — magnitude only"
    },
    {
      "slotId": "simple-diagnose-and-vitals//content[openEHR-EHR-SECTION.adhoc.v1]/items[openEHR-EHR-OBSERVATION.blood_pressure.v2]/data/at0001/events/at0006/time/value",
      "block": {
        "type": "source_query",
        "fields": { "EXPRESSION": "$.timestamp" }
      }
    },
    {
      "slotId": "simple-diagnose-and-vitals//content[openEHR-EHR-SECTION.adhoc.v1]/items[openEHR-EHR-OBSERVATION.pulse.v2]/data/at0002/events/at0003/data/at0001/items/at0004/value/value/value",
      "block": {
        "type": "source_query_number",
        "fields": { "EXPRESSION": "$.pulse" }
      },
      "note": "unitsFixed /min — magnitude only"
    },
    {
      "slotId": "simple-diagnose-and-vitals//content[openEHR-EHR-SECTION.adhoc.v1]/items[openEHR-EHR-OBSERVATION.pulse.v2]/data/at0002/events/at0003/time/value",
      "block": {
        "type": "source_query",
        "fields": { "EXPRESSION": "$.timestamp" }
      }
    },
    {
      "slotId": "simple-diagnose-and-vitals//content[openEHR-EHR-SECTION.adhoc.v1]/items[openEHR-EHR-OBSERVATION.blood_pressure.v2]/data/at0001/events/at0006/state/at0007/items/at0008/value/DV_CODED_TEXT/value",
      "block": {
        "type": "maps_create_with",
        "extraState": { "itemCount": 3 },
        "fields": { "KEY0": "value", "KEY1": "code_string", "KEY2": "terminology_id" },
        "inputs": {
          "VAL0": {
            "block": {
              "type": "decision_table",
              "fields": { "NAME": "body_position", "OUTPUT": "label" },
              "inputs": {
                "INPUTS": {
                  "block": {
                    "type": "maps_create_with",
                    "extraState": { "itemCount": 1 },
                    "fields": { "KEY0": "position" },
                    "inputs": {
                      "VAL0": {
                        "block": { "type": "source_query", "fields": { "EXPRESSION": "$.bodyPosition" } }
                      }
                    }
                  }
                }
              }
            }
          },
          "VAL1": {
            "block": {
              "type": "decision_table",
              "fields": { "NAME": "body_position", "OUTPUT": "code" },
              "inputs": {
                "INPUTS": {
                  "block": {
                    "type": "maps_create_with",
                    "extraState": { "itemCount": 1 },
                    "fields": { "KEY0": "position" },
                    "inputs": {
                      "VAL0": {
                        "block": { "type": "source_query", "fields": { "EXPRESSION": "$.bodyPosition" } }
                      }
                    }
                  }
                }
              }
            }
          },
          "VAL2": {
            "block": { "type": "text", "fields": { "TEXT": "local" } }
          }
        }
      },
      "note": "Decision table sitting/standing/lying/reclining → openEHR blood-pressure Position"
    }
  ]
}
